q_id,question,context
0b2699de-e028-4554-a174-c1a664a91f32,What is the student-to-faculty ratio?,The student-to-faculty ratio is a measure of how many students there are for each faculty member at a school. A lower ratio generally indicates that students have more individualized attention and support from their instructors. Be sure to ask about the student-to-faculty ratio when researching schools to find the best fit for your needs.
f5fd33ef-3e47-4503-8b43-6bbd8d9a7d05,How do I apply for financial aid?,"To apply for financial aid, students should complete the Free Application for Federal Student Aid (FAFSA) online. This application will be used to determine eligibility for federal grants, loans, and work-study programs. Some universities may also require additional financial aid applications or forms."
f43b1f91-0baa-41fb-9aa0-d286fe5ad873,What is the difference between a college and a university?,"The terms ""college"" and ""university"" are often used interchangeably, but there are some differences. Generally, a college is a smaller institution that offers undergraduate degrees, while a university offers both undergraduate and graduate degrees in a variety of fields."
36632955-6e2e-4b55-aec5-b5f8498166e5,How do I transfer credits from one school to another?,"To transfer credits from one school to another, students should contact the registrar's office at both schools to determine the transferability of credits. Generally, credits earned at regionally accredited institutions are more likely to transfer than credits earned at non-accredited institutions."
6db7101a-7b54-4f3b-a536-a63f1c129fd8,What is the difference between a bachelor's degree and an associate's degree?,"A bachelor's degree is a four-year degree that typically requires completion of general education requirements, major-specific coursework, and elective courses. An associate's degree is a two-year degree that typically focuses on general education requirements and introductory courses in a specific field."
83baf2bb-e23f-433d-b789-511cf3a54778,How do I find scholarships for college?,"To find scholarships for college, students can search online scholarship databases, check with their high school counselor or college financial aid office, and research scholarships offered by professional organizations and community groups."
b1f9a1d6-62e5-4e3f-ac32-9bfd71988df2,What is the difference between a grant and a loan?,"A grant is a form of financial aid that does not need to be repaid, while a loan is a form of financial aid that must be repaid with interest. Grants are typically awarded based on financial need, while loans may be awarded based on financial need or merit."
b6d02dfd-9b12-4309-8f34-674c9ec8f797,What is the average cost of tuition for a four-year degree?,"The average cost of tuition for a four-year degree varies depending on the type of institution and the student's residency status. In-state tuition at public universities is generally less expensive than out-of-state tuition or tuition at private universities. The average cost of tuition and fees for in-state students at public universities was $10,560 for the 2020-2021 academic year, according to the College Board."
59bd247e-ad8e-45a1-b712-0a2ee2cb94f9,How do I apply for a student loan?,"To apply for a student loan, students should complete the Free Application for Federal Student Aid (FAFSA) online. This application will be used to determine eligibility for federal student loans. Students may also need to complete additional loan applications or forms through their university or a private lender."
60b4f810-711b-4275-b511-8be8486d0aab,What is the difference between a major and a minor?,"A major is the primary field of study that a student chooses to focus on in college, while a minor is a secondary field of study. A major typically requires more coursework and is the primary area of expertise for the student, while a minor requires fewer courses and is often used to supplement the major or explore other interests."
cf503f12-3eb8-4caf-9df4-0e585fc85812,What are the admission requirements for your university?,"Our university requires a completed application, official transcripts, and standardized test scores. Additional requirements may vary by program."
2e77f2b1-15d9-4f79-aea7-9d04710790aa,Can you tell me more about the financial aid options available for students?,"We offer a variety of financial aid options, including scholarships, grants, and loans. Our financial aid office can assist you in determining your eligibility and applying for aid."
7b9f3221-001b-41f6-8757-b4eb40ee5dd3,How do I apply for a student loan?,You can apply for a student loan by completing the Free Application for Federal Student Aid (FAFSA) and contacting our financial aid office for assistance.
e593b169-222f-4f3e-88c4-b9ef1413a621,What types of programs do you offer for adult learners?,"We offer a variety of programs for adult learners, including online courses, evening classes, and flexible scheduling options. Our admissions office can provide more information on specific programs."
12be1d33-57d3-433f-8cdc-bdc502264145,Can you tell me more about the student housing options available on campus?,"We offer a variety of student housing options, including residence halls, apartments, and townhouses. Our housing office can provide more information on availability and application processes."
cd6772a7-e699-4d2f-8153-4ab885950657,How do I transfer credits from another institution?,You can transfer credits by submitting official transcripts from your previous institution to our admissions office for evaluation. Our transfer credit policies vary by program.
42254d67-1004-4eec-a06c-891ae9469cd6,Can you tell me more about the study abroad programs available at your university?,We offer a variety of study abroad programs in locations around the world. Our study abroad office can provide more information on program options and application processes.
3e271579-4d0e-471a-b656-4f2edcdc0ff8,How do I apply for graduate school?,"You can apply for graduate school by completing the application process for your desired program and submitting any required materials, such as transcripts and letters of recommendation. Our graduate admissions office can provide more information on specific program requirements."
8ca7c36e-3c8a-4d07-946c-074600b2de4c,What is the difference between a college and a university?,"Colleges typically offer undergraduate degrees and vocational training, while universities offer undergraduate and graduate degrees and conduct research."
9085c730-6db1-490e-b2cc-0d4d0eddc612,How do I apply for financial aid?,"You can apply for financial aid by completing the Free Application for Federal Student Aid (FAFSA) online. The FAFSA determines your eligibility for federal grants, loans, and work-study programs."
d36a8e62-4411-474e-abf3-e19eb0c03365,What is the difference between a scholarship and a grant?,"Scholarships are typically awarded based on merit or achievement, while grants are awarded based on financial need."
bcc99e8c-5e2f-4446-a8cc-b5910edc46d9,How do I find out if a school is accredited?,You can check a school's accreditation status by visiting the website of the accrediting agency or by searching the U.S. Department of Education's database of accredited schools.
33805461-59ae-4a39-a235-7e2af6005398,How do I transfer credits from one school to another?,You can transfer credits by requesting your official transcripts from your previous school and submitting them to your new school for evaluation.
23cd872f-b728-424d-87d0-28dd628e2929,What is the difference between online and traditional classroom learning?,"Online learning allows students to complete coursework and interact with instructors and classmates virtually, while traditional classroom learning takes place in a physical classroom setting."
627d82d2-15ff-440f-a0b0-6c2a092b43e9,How do I choose a major?,"You can choose a major by considering your interests, skills, and career goals, and by researching the requirements and opportunities of different majors."
7d31a411-01b5-492a-8d2c-71bb6659fde7,What is the average cost of tuition for a four-year degree?,"The average cost of tuition for a four-year degree varies depending on the school and location, but it can range from several thousand dollars to tens of thousands of dollars per year."
4fc966d0-2381-45a5-bc71-9f46556131be,How can I get involved in extracurricular activities on campus?,"You can get involved in extracurricular activities by attending club fairs, joining student organizations, and participating in campus events."
3933d94b-7a4d-48da-82d0-b6697441120a,What are the requirements to enroll in your university's undergraduate program?,"To enroll in our undergraduate program, you will need to have completed high school or an equivalent program, and meet our minimum GPA and standardized test score requirements. You can find more information on our website or by speaking with an admissions counselor."
7db69a9c-20f3-45f3-a793-c53af58f2e39,Can you tell me more about the financial aid options available for graduate students?,"We offer a variety of financial aid options for graduate students, including scholarships, grants, and loans. Our financial aid office can help you determine which options are best for you based on your individual circumstances."
079af077-6917-40eb-be4a-12db241473ce,How can I transfer credits from another institution to your university?,"To transfer credits from another institution to our university, you will need to submit an official transcript and have the courses evaluated by our admissions office. The evaluation will determine which credits will transfer and how they will apply to your degree program."
593bb9b1-b8d2-4aa4-959c-cf5047e0b033,What resources does your university offer for students with disabilities?,"We offer a range of resources and accommodations for students with disabilities, including assistive technology, accessible housing, and specialized academic support. Our disability services office can work with you to determine which accommodations are appropriate for your needs."
14ab6c19-7a70-44c3-b791-5f064599ee30,How can I get involved in research opportunities at your university?,"There are many ways to get involved in research opportunities at our university, including working with faculty members on research projects, participating in undergraduate research programs, and applying for research grants. You can find more information on our website or by speaking with your academic advisor."
d3094a5d-ae7e-4fa7-9fb5-a692889dc50f,Can you tell me more about the accreditation of this university?,"Our university is accredited by the Higher Learning Commission, which means that we meet rigorous standards for academic quality and student support services."
7debc501-8185-49ce-8783-8ce8ea236a50,What are the requirements for transferring to your university?,The requirements for transferring vary depending on your current institution and program of study. We recommend that you speak with an admissions counselor to discuss your specific situation.
67a8cba3-0ad7-4031-9390-62d71d06f568,What is the student-to-faculty ratio at your university?,"Our university has a student-to-faculty ratio of 15:1, which means that you will have plenty of opportunities to engage with your professors and receive individualized attention."
e9cce328-93b3-498e-8f4e-19e7bcdb9f2f,Can you provide more information about the online degree programs offered at your university?,"We offer a variety of online degree programs in fields such as business, education, and healthcare. Our online courses are designed to be flexible and convenient, allowing you to balance your studies with your other commitments."
ac642e45-f668-4e1f-9a5c-2cfc0422aff1,How can I get involved in extracurricular activities on campus?,"There are many ways to get involved in extracurricular activities on campus, including joining student organizations, participating in service projects, and attending campus events. We encourage you to explore the opportunities available and find something that interests you."
98c0ef78-7939-4781-8017-de9659f6d606,What resources are available for students with disabilities?,Our university has a dedicated disability services office that provides accommodations and support services for students with disabilities. We are committed to ensuring that all students have equal access to our programs and facilities.
8a3f9dd8-7594-4731-9a41-74d683c64b9f,Can you tell me about the job placement rates for graduates of your university?,"Our university has a strong track record of helping students find employment after graduation. Our career services office provides a range of resources, including job fairs, resume writing workshops, and networking events, to help students connect with potential employers."
5bda5313-e2df-4912-b971-f2a65e93b2dc,What is the average class size at your university?,"The average class size at our university is 25 students, which allows for a dynamic and interactive learning environment."
7349f2da-c479-4706-96cb-c3f7dd50af5c,What types of scholarships are available for students at your university?,"We offer a variety of scholarships for students based on academic achievement, financial need, and other criteria. We encourage you to explore the options available and apply for any scholarships for which you may be eligible."
8336a2e4-9d5b-4b72-ac4a-c13105fa0138,What are the admission requirements for your college/university?,"We require students to have a high school diploma or equivalent, and meet specific GPA and standardized test score requirements. Additionally, some programs may have additional admission requirements."
ea61cc9e-4c76-4a61-a65e-96eb96ab429b,How long does it take to complete a bachelor's degree?,"Typically, it takes four years to complete a bachelor's degree, assuming the student is enrolled full-time and does not take any breaks."
93441de1-611c-4325-a14c-a358c6873ce6,Can I transfer credits from another institution?,"Yes, we accept transfer credits from other accredited institutions. However, the number of credits that can be transferred may vary depending on the program and institution."
f1fb4bee-f1f9-45be-9f28-92ab92013178,What types of financial aid are available?,"We offer a variety of financial aid options, including scholarships, grants, and loans. Students can apply for financial aid by completing the FAFSA (Free Application for Federal Student Aid)."
bcd00057-3dc7-4c57-abe1-910dd924c40d,How do I apply for a scholarship?,"Students can apply for scholarships by completing the scholarship application and submitting it by the deadline. Scholarship applications may require essays, letters of recommendation, and other supporting documents."
feab4ab6-8525-4c32-8edb-7a89427d1a88,What is the student-to-faculty ratio?,"Our student-to-faculty ratio varies by program, but we strive to maintain a low ratio to ensure that students receive individualized attention and support from their instructors."
1dbad10c-5291-493e-ad99-1e2b6d93ae92,What is the graduation rate for your institution?,"Our graduation rate varies by program, but we are proud to have a high rate of students who successfully complete their degree programs."
198250d8-a2ba-4fe8-8c28-f8d132764b8d,What types of student support services are available?,"We offer a variety of student support services, including tutoring, academic advising, career counseling, and disability services. We also have a variety of student organizations and clubs to help students get involved on campus."
a9bfa924-19c5-4a57-b4d9-8159d2594607,Can I study abroad while enrolled at your institution?,"Yes, we offer a variety of study abroad programs for students who want to gain international experience and expand their cultural horizons. Students can work with their academic advisors to find a program that meets their needs and interests."
5aa873dd-f763-4fde-8c3f-db12ebb67fa2,What is the job placement rate for graduates of your institution?,"Our job placement rate varies by program, but we work closely with employers to ensure that our graduates have the skills and experience needed to succeed in their chosen fields. We also offer career services to help students prepare for job interviews and find employment after graduation."
40fd1833-7162-48a8-8454-4d0935997adb,How do I apply for financial aid?,You can apply for financial aid by completing the Free Application for Federal Student Aid (FAFSA) online. Be sure to have your tax information and any other relevant financial documents handy.
59f9d2bd-541f-4747-a2c4-7fa205196fa8,How can I find out about scholarships?,Check with your school's financial aid office or search online for scholarship opportunities. You can also check with professional organizations or community groups for scholarship opportunities.
16f151ce-b6ed-4fdd-91f1-456798eee1aa,How do I know if a school is accredited?,You can check a school's accreditation status by visiting the website of the accrediting agency. The U.S. Department of Education also provides a database of accredited schools.
2e18e07c-33f6-486d-94f6-f24675676765,What is the difference between a bachelor's degree and an associate's degree?,A bachelor's degree typically takes four years to complete and is a more comprehensive program that includes general education requirements and specific coursework in a major field of study. An associate's degree typically takes two years to complete and focuses more on general education requirements and introductory coursework in a major field of study.
b39827d9-3335-4fb9-8e63-c8d70d153f06,How can I transfer credits from one school to another?,Contact the registrar's office at both schools to find out about their transfer credit policies. You may need to provide transcripts and course syllabi to determine if your credits are transferable.
2fdbc741-b4bf-440d-82f1-57ef56b6bd17,How can I find out about job opportunities in education?,Check with your school's career center or search online for job postings in education. You can also check with professional organizations or community groups for job opportunities.
61d3a666-6f5e-40c5-bac2-ff65b6299441,How do I apply for financial aid?,You can apply for financial aid by filling out the Free Application for Federal Student Aid (FAFSA) online. Be sure to include all necessary documentation and submit your application before the deadline.
d3281ad8-c86e-4842-a34a-b2fc5bab6b8d,Can I transfer my credits from another institution?,"Yes, you may be able to transfer credits from another institution. Contact the admissions office at the school you are interested in attending to learn more about their transfer credit policies."
0a37cd78-6db8-4c77-8ab7-96082e04baab,What are the admission requirements for your school?,Admission requirements vary by school and program. Contact the admissions office at the school you are interested in attending to learn more about their specific requirements.
0ad276fa-d04b-415b-886b-1c2b6589a441,How do I register for classes?,"You can typically register for classes online through the school's student portal. If you have any issues, contact the registrar's office for assistance."
601542ac-9f9f-472e-b359-8d86297f17fc,What is the tuition cost for your school?,Tuition costs vary by school and program. Contact the financial aid office at the school you are interested in attending to learn more about their tuition and fee schedule.
58b9bf45-b911-4a2e-ad63-b303857bdd81,Are there any scholarships available for incoming students?,"Yes, many schools offer scholarships for incoming students. Contact the financial aid office at the school you are interested in attending to learn more about their scholarship opportunities."
96014ae4-7b2b-4d97-8a2b-bed7ea32a7e0,How do I apply for housing on campus?,"You can typically apply for housing on campus through the school's student portal. If you have any issues, contact the housing office for assistance."
4b13a73e-a9c5-48e0-a870-cb1f494f1a65,What types of extracurricular activities are available on campus?,"Many schools offer a variety of extracurricular activities, such as clubs, sports teams, and volunteer opportunities. Contact the student life office at the school you are interested in attending to learn more about their offerings."
05a9bcc8-ea4d-40a4-bcd2-85b08b645c43,What are the admission requirements for your university?,"Our university requires applicants to have a high school diploma or equivalent, as well as satisfactory scores on standardized tests such as the SAT or ACT."
16284514-9324-4f66-89fd-6371f6a5eb50,Can you tell me more about the financial aid options available for students?,"We offer a variety of financial aid options, including scholarships, grants, loans, and work-study programs. Our financial aid office can help you determine which options are best for you."
12943366-967b-479e-99fa-4c631200e6bb,How can I apply for a student loan?,You can apply for a student loan by filling out the Free Application for Federal Student Aid (FAFSA) online. Our financial aid office can also assist you with the application process.
47437d7c-edca-4636-a523-a2de2e75ce68,What is the student-to-faculty ratio at your college?,"Our college has a student-to-faculty ratio of 12:1, which allows for personalized attention and support from our faculty."
ebb5dcff-17b1-4711-84b3-e501035e790a,What majors are available at your university?,"We offer a wide range of majors, including business, engineering, education, nursing, and many others. You can find a complete list of our majors on our website."
37bcf10a-4016-4d69-97d1-36250d0d29d1,Can you tell me more about the study abroad programs offered by your college?,"We offer a variety of study abroad programs in countries around the world, allowing students to gain valuable international experience and cultural immersion. Our study abroad office can provide more information on specific programs and requirements."
c91fb548-6e5a-46ec-aa2b-341e8f495605,What is the average class size at your university?,"Our university has an average class size of 20 students, ensuring a collaborative and engaging learning environment."
62fe94ed-2f2f-4b40-b632-e83c6492439c,How can I schedule a campus tour?,You can schedule a campus tour by contacting our admissions office or by filling out a tour request form on our website. Our admissions staff will be happy to show you around and answer any questions you may have.
328c97a7-dde4-45d9-b867-e9544d08914e,What is the graduation rate at your college?,"Our college has a graduation rate of 85%, indicating a strong commitment to student success and support."
1f8c46d1-2463-40f3-8924-7b8872102baf,Can you tell me more about the research opportunities available for students at your university?,"We offer a variety of research opportunities for students, including undergraduate research programs, research assistantships, and partnerships with industry and government organizations. Our research office can provide more information on specific opportunities and requirements."
cd5336c1-ba16-449c-9c38-1961d45723c5,What is the difference between a college and a university?,"Colleges typically offer undergraduate degrees, while universities offer both undergraduate and graduate degrees. Universities also tend to be larger and have more diverse course offerings."
d2eac3b0-fd7e-4c90-b357-9d38239959bb,How do I apply for financial aid?,"To apply for financial aid, you must fill out the Free Application for Federal Student Aid (FAFSA). This form is used to determine your eligibility for federal grants, loans, and work-study programs."
f2e766c0-8768-460c-958e-51894c89de6e,What is the average cost of tuition at a four-year university?,"The average cost of tuition at a four-year university varies depending on the institution and whether you are an in-state or out-of-state student. However, according to the College Board, the average cost of tuition and fees for the 2020-2021 academic year was $10,560 for in-state students at public four-year institutions and $37,650 for private four-year institutions."
b427f469-552b-4e4b-a04a-699451b4f501,What is the difference between a grant and a scholarship?,"Grants and scholarships are both forms of financial aid that do not need to be repaid. However, grants are typically need-based, while scholarships are typically merit-based."
a9c4dcbe-0a98-4b48-bf75-151f9392aa7a,How do I transfer credits from one school to another?,"To transfer credits from one school to another, you must first contact the registrar's office at both institutions to determine which credits are transferable. You may also need to provide transcripts and course descriptions."
05307c9a-c68c-40dc-9d43-20279dfb8d22,What is a student loan?,"A student loan is a type of loan specifically designed to help students pay for their education. Unlike grants and scholarships, student loans must be repaid with interest."
fa986bf4-064a-4375-aa0c-485a65d69f99,What is the difference between a bachelor's degree and an associate's degree?,"A bachelor's degree typically takes four years to complete and offers a more comprehensive education in a particular field. An associate's degree, on the other hand, typically takes two years to complete and provides a more general education in a particular field."
1ca45712-894f-4ef5-a691-6b5d34987897,How do I apply for admission to a college or university?,"To apply for admission to a college or university, you must typically submit an application form, transcripts, test scores, and possibly essays or letters of recommendation. You should also check with the institution to see if there are any additional requirements or deadlines."
385e847f-e852-466e-846f-0fd0c4249add,What types of financial aid are available for college students?,"There are many types of financial aid available for college students, including scholarships, grants, work-study programs, and student loans."
