q_id,question,context
b337db7a-099d-41d0-b99f-2e26ca8387a3,What is the student-to-faculty ratio at your university?,"Our university has a student-to-faculty ratio of 15:1, which means that our students receive personalized attention and support from our dedicated faculty members. We believe that this ratio helps to create a dynamic and engaging learning environment for our students."
b69f4d3b-a235-43b7-b34d-dc1cfe2282fe,Can you tell me more about the study abroad programs available at your college?,"We offer a variety of study abroad programs for our students, including semester-long programs, short-term programs, and internships abroad. These programs provide students with the opportunity to immerse themselves in a different culture, gain valuable experience, and broaden their horizons. To learn more about our study abroad options, please visit our website or speak with one of our study abroad advisors."
acb52906-f3e1-4d8e-bc83-2d3ed1f472d7,What is the application deadline for your university?,"The application deadline for our university varies depending on the program and semester for which you are applying. To see the specific deadlines for your program of interest, please visit our website or speak with one of our admissions advisors."
a08647ba-e8b2-4373-ab6a-d7af1e4ec4c7,What kind of career services do you offer to students?,"We offer a variety of career services to our students, including resume and cover letter review, job search assistance, and career counseling. We also host career fairs and networking events to help students connect with employers and explore different career paths. To learn more about our career services, please visit our website or speak with one of our career advisors."
92a1c45c-52c1-4bb7-9737-2ff530879fcd,How do I transfer credits from one school to another?,You can transfer credits by requesting an official transcript from your previous school and submitting it to your new school's registrar's office.
24d19f49-2678-4f89-8412-e1802be8eed5,What is the average class size at your university?,Our university has an average class size of 25 students.
bed0e63a-51a3-46fe-8b01-c993bc1e3a86,How do I apply for scholarships?,You can apply for scholarships by checking with your school's financial aid office or searching for external scholarships online. Be sure to carefully read the eligibility requirements and application instructions.
13782854-526f-4d2a-ba1d-574346772ccc,What is the deadline to apply for admission?,The deadline to apply for admission varies depending on the school and program. Check with the admissions office for specific deadlines and requirements.
84f183a5-fb7f-4f7d-964f-08d4bef8ea30,Can I take online courses?,"Yes, many schools offer online courses and programs. Check with your school's academic advisor for more information."
6d2e5dca-df79-4656-a773-de67ef584658,How do I know which major to choose?,"Consider your interests, skills, and career goals when choosing a major. You can also talk to academic advisors and career counselors for guidance."
69bb81e7-bf0c-45c1-ada4-95d5c56a7f1f,How do I apply for a student visa?,You can apply for a student visa by completing the necessary forms and providing required documentation. Check with your school's international student office for more information.
c1ee6c22-5655-491c-bc02-cb7b107be89f,What is the cost of tuition?,The cost of tuition varies depending on the school and program. Check with the school's financial aid office for specific costs and available financial aid options.
e4512dcc-31cd-4f95-8dde-fb1c8c9de7d3,Can you tell me more about your admissions process?,Of course! Our admissions process varies depending on the program and level of education you are interested in. Please visit our website or give us a call to learn more about the specific requirements and steps involved.
949f2fb4-2efb-4f69-8a9e-be27d72b200d,What are the tuition fees for your programs?,Our tuition fees vary depending on the program and level of education you are interested in. Please visit our website or give us a call to learn more about the specific costs and any financial aid options that may be available.
4defe9c7-9000-4a4a-b070-89f6ad731f6f,Can you tell me more about the curriculum for your program?,Absolutely! Our curriculum is designed to provide students with a comprehensive education in their chosen field. Please visit our website or give us a call to learn more about the specific courses and requirements for the program you are interested in.
06abc8bd-c2b7-4cdd-87da-4b1419ceb982,Are there any scholarships or grants available for students?,"Yes, we offer a variety of scholarships and grants for students who meet certain criteria. Please visit our website or give us a call to learn more about the specific options and requirements."
33bcc62e-ba17-48c0-afcc-e95e39956335,What kind of job opportunities are available for graduates of your program?,Our graduates have gone on to successful careers in a variety of fields related to their area of study. Please visit our website or give us a call to learn more about the specific job opportunities and career paths that may be available to you.
e143e6b5-6e59-4fb2-b083-4ebfcbcf5b1f,Can you tell me more about the facilities and resources available to students?,Absolutely! We pride ourselves on providing our students with state-of-the-art facilities and resources to support their education and success. Please visit our website or give us a call to learn more about the specific resources and facilities available to students.
f22a15a9-cef0-406f-ab12-9948ceba4a92,What kind of support services do you offer to students?,"We offer a variety of support services to help our students succeed, including academic advising, tutoring, career services, and more. Please visit our website or give us a call to learn more about the specific support services available to students."
ef25ae3b-f618-47a6-9913-70fbace423be,What is the student-to-faculty ratio at your institution?,Our student-to-faculty ratio varies depending on the program and level of education you are interested in. Please visit our website or give us a call to learn more about the specific ratio for the program you are interested in.
338b7427-c200-4a48-920b-ed9d4f4ab94c,Can you tell me more about the accreditation of your institution?,Absolutely! We are proud to be accredited by [insert name of accrediting agency]. Please visit our website or give us a call to learn more about our accreditation and what it means for our students.
3f2aeb76-9f9f-4ddb-973e-7785d8d81c56,What kind of extracurricular activities are available to students?,"We offer a variety of extracurricular activities to help our students get involved and make the most of their college experience, including clubs, sports teams, volunteer opportunities, and more. Please visit our website or give us a call to learn more about the specific options available to students."
79c65338-096f-41d6-a106-99bad06610eb,Can you tell me more about the financial aid options available for students?,"We offer a variety of financial aid options, including scholarships, grants, and student loans. You can find more information on our website or by contacting our financial aid office."
8b99d70a-84ec-424d-a9d5-5ff72d4cca64,How can I apply for a student visa to study in your country?,"You can apply for a student visa through the embassy or consulate of our country in your home country. You will need to provide proof of enrollment in a recognized educational institution, proof of financial support, and other required documents."
e5194058-79a2-462d-a134-28e2f638af79,What is the student-to-faculty ratio at your university?,"Our student-to-faculty ratio varies depending on the program, but we strive to maintain a low ratio to ensure that our students receive personalized attention and support from our faculty."
ef9a26f3-ea9d-416e-9090-c551f4155ce1,Can you tell me more about the research opportunities available for undergraduate students?,"We offer a variety of research opportunities for undergraduate students, including research assistantships, independent study projects, and summer research programs. You can find more information on our website or by contacting our research office."
776d85bd-587c-4c21-b951-e91daa47f378,What is the average class size at your university?,"Our average class size varies depending on the program, but we strive to maintain small class sizes to ensure that our students receive personalized attention and support from our faculty."
e27fae66-b747-4bb9-b1de-7d32f21b309c,How can I schedule a campus tour?,You can schedule a campus tour by contacting our admissions office. We offer both in-person and virtual tours to accommodate your needs.
9a559ad5-bef2-4fd6-900d-60c999eac03b,Can you tell me more about the student organizations on campus?,"We have a wide variety of student organizations on campus, including academic clubs, sports teams, and social clubs. You can find more information on our website or by contacting our student life office."
faa25d83-714f-4e93-9b37-5a3d7162bc6b,What is the graduation rate for your university?,"Our graduation rate varies depending on the program, but we are proud to have a high overall graduation rate. You can find more information on our website or by contacting our admissions office."
0a878414-ae07-4da9-9fca-0ef2222fb31d,How can I apply for a transfer to your university?,You can apply for a transfer to our university by submitting an application through our admissions office. You will need to provide transcripts from your current institution and other required documents.
58a891cd-6f2c-42ff-92f6-4acc01836757,How do I apply for financial aid for college?,"You can apply for financial aid for college by filling out the Free Application for Federal Student Aid (FAFSA) online. This application will determine your eligibility for federal grants, loans, and work-study programs."
0677eaae-30db-4e63-84a5-28ac13d24ba8,What is the difference between a college and a university?,"Generally, a college is a smaller institution that offers undergraduate degrees, while a university is a larger institution that offers both undergraduate and graduate degrees. However, there are exceptions to this rule, and the terms are sometimes used interchangeably."
19699e0f-b202-481c-a32a-d9c20a84e6b4,How do I request a transcript from my college?,You can typically request a transcript from your college by filling out a form on their website or in person at the registrar's office. There may be a fee associated with this service.
28c13016-f734-4b7d-8e5c-c61ba70ab988,What is the average cost of tuition at a four-year college?,"The average cost of tuition at a four-year college varies depending on the institution and location. According to the College Board, the average tuition and fees for the 2020-2021 academic year was $10,560 for in-state students at public four-year institutions and $37,650 for private four-year institutions."
464f6694-bc12-4425-a6c5-71197fa80094,How do I know if a college is accredited?,You can check if a college is accredited by searching for it on the website of the Council for Higher Education Accreditation (CHEA) or the U.S. Department of Education's Database of Accredited Postsecondary Institutions and Programs.
f1ce20b3-3676-4114-8e4c-5478ed0b439b,What is the difference between a bachelor's degree and an associate's degree?,"A bachelor's degree typically takes four years to complete and is a more in-depth and specialized program of study, while an associate's degree typically takes two years to complete and is a more general program of study."
060dbee4-2ff9-493a-ae05-d8c8d511d126,How do I apply for a scholarship?,"You can apply for a scholarship by researching available scholarships online and filling out the application forms. Some scholarships may require additional materials, such as essays or letters of recommendation."
a676de7b-d766-4452-928a-b08d292ca394,What is the average salary for someone with a master's degree?,"The average salary for someone with a master's degree varies depending on the field and industry, but according to the Bureau of Labor Statistics, the median weekly earnings for workers with a master's degree in 2020 was $1,497."
1f4b09b7-2431-4e0c-870d-8f4ad6ec2a78,How do I apply for financial aid?,You can apply for financial aid by filling out the Free Application for Federal Student Aid (FAFSA) form. This form is available online and will ask for information about your income and assets to determine your eligibility for federal aid.
b1fbe3fb-6587-492d-a734-837fd31c3a25,What is the difference between a grant and a loan?,"A grant is a form of financial aid that does not need to be repaid, while a loan is money that you borrow and must pay back with interest."
f4cca687-b2a2-47aa-8d41-18aff851d8d3,Can I transfer credits from another college?,"Yes, you can transfer credits from another college as long as the credits are from an accredited institution and the courses are similar to those offered at the school you are transferring to."
b32ce929-b0e1-4193-964d-807d1b8fb4d5,How do I know if a school is accredited?,You can check if a school is accredited by visiting the website of the accrediting agency or by checking the U.S. Department of Education's Database of Accredited Postsecondary Institutions and Programs.
e16f5f6b-3009-4367-b6b6-245ec695d0c4,What is the difference between a bachelor's degree and an associate's degree?,"A bachelor's degree typically takes four years to complete and provides a more in-depth education in a specific field, while an associate's degree takes two years and provides a more general education."
8f1414e2-49db-41cb-a7bd-161c51db97c8,Can I take online courses?,"Yes, many schools offer online courses that can be taken from anywhere with an internet connection."
0ea2a814-169f-4813-913f-f932869fdd2f,What is the average cost of tuition?,"The average cost of tuition varies depending on the school and the program, but according to the College Board, the average cost of tuition and fees for the 2020-2021 school year was $10,560 for in-state students at public four-year colleges and $37,650 for private four-year colleges."
745ae769-dfff-40fc-a4e3-7291f2464f44,What is the difference between a public and a private college?,"Public colleges are funded by the government and typically have lower tuition costs, while private colleges are funded by private donations and tuition and often have higher tuition costs but may offer more financial aid."
eb400294-1da2-4c0c-bcce-9eca4d847522,How do I apply for scholarships?,"You can apply for scholarships by searching for them online or through your school's financial aid office. Many scholarships require an application, essay, or other materials to be submitted for consideration."
a965e84d-69da-446a-b287-3c6c0d332db9,What are the admission requirements for your school?,"Our school requires a completed application, transcripts from previous schools, and any standardized test scores."
b53550dc-3c93-4d60-80ab-3aec7e8799f2,What is the tuition cost for your school?,Our tuition costs vary depending on the program and degree level. Please visit our website or contact our admissions office for more information.
4cb69819-cc82-4730-9838-2bec201f9fd0,What types of financial aid are available for students?,"We offer a variety of financial aid options, including scholarships, grants, and student loans. Our financial aid office can provide more information on eligibility and application requirements."
fc8dadaa-777e-4443-9839-cc9767204243,Can I transfer credits from another school?,"Yes, we accept transfer credits from accredited institutions. Our admissions office can provide more information on the transfer process and requirements."
07241ba4-b288-4ab5-8c74-672a3dd3d7f2,What is the student-to-faculty ratio at your school?,Our student-to-faculty ratio varies depending on the program and degree level. Please visit our website or contact our admissions office for more information.
619e7739-7bdc-4f48-88b3-f13b391e9c41,What types of student services are available on campus?,"We offer a variety of student services, including academic advising, career counseling, tutoring, and wellness services. Our student services office can provide more information on available resources."
ae9a97cb-a81b-44f5-86a3-399b01363c28,What is the graduation rate at your school?,Our graduation rate varies depending on the program and degree level. Please visit our website or contact our admissions office for more information.
12b96e6a-3e04-4ab2-a1b4-43cc593fef31,Are there any extracurricular activities available for students?,"Yes, we offer a variety of extracurricular activities, including clubs, sports teams, and volunteer opportunities. Our student activities office can provide more information on available options."
9b4bbcb7-b24b-4740-8572-f8a4a4cd7d44,What is the job placement rate for graduates of your school?,Our job placement rate varies depending on the program and degree level. Please visit our website or contact our career services office for more information.
df873a53-ece3-477f-9694-b4330a780c4d,What is the accreditation status of your school?,Our school is accredited by [insert accrediting body here]. More information on our accreditation status is available on our website or by contacting our admissions office.
097eba6e-2ccc-403f-b723-461f15424180,What is the difference between a college and a university?,"Generally, a college offers undergraduate degrees and may have a more narrow focus on specific areas of study, while a university offers both undergraduate and graduate programs and has a wider range of academic offerings."
613d6f43-d604-4595-8766-f7d4b36c7414,How do I know if a school is accredited?,You can check if a school is accredited by searching for it on the website of the Council for Higher Education Accreditation (CHEA) or the U.S. Department of Education's Database of Accredited Postsecondary Institutions and Programs.
22bab3aa-2b87-4a3a-b851-6ad3f0453200,How can I transfer credits from one school to another?,You can transfer credits by contacting the registrar's office at both schools and requesting a transcript evaluation. The receiving school will determine which credits are transferable based on their own policies and the evaluation of your transcript.
d982516c-3fdb-4577-9be6-914cd9b813ac,What is the difference between a grant and a scholarship?,"Both grants and scholarships are forms of financial aid that do not need to be repaid, but grants are typically awarded based on financial need, while scholarships are awarded based on merit or other criteria."
8b023601-320a-40fa-8405-dea825fd580a,How do I know if a degree program is right for me?,"You can research the program by looking at its curriculum, reading reviews from current or former students, and speaking with an academic advisor or career counselor. It's also important to consider your own interests, skills, and career goals."
d9c01597-bb05-42f5-9461-c3adc0f26bab,How can I prepare for college entrance exams?,"You can prepare for college entrance exams by studying the test format and content, taking practice tests, and seeking out resources such as study guides or test prep courses."
11cefcd8-bd79-41ab-9bcd-9800261644c4,What are the benefits of studying abroad?,"Studying abroad can provide opportunities for personal and academic growth, cultural immersion, language learning, and career advancement. It can also broaden your perspective and enhance your resume."
813cc57e-f38a-4784-b922-1d7b36a0ca1d,What are the admission requirements for your college?,"The admission requirements vary by program, but typically include a high school diploma or equivalent, standardized test scores, and letters of recommendation. You can find specific requirements for each program on our website."
e2f1e1f7-5780-4516-8366-40738da26241,How much does it cost to attend your university?,The cost of attendance varies depending on the program and whether you are an in-state or out-of-state student. You can find detailed information about tuition and fees on our website or by speaking with a financial aid advisor.
2f5f5cf6-9630-4319-afc2-a8f45e7fb633,What types of financial aid are available for students?,"We offer a variety of financial aid options, including scholarships, grants, loans, and work-study programs. Our financial aid advisors can help you determine which options are best for your individual needs."
e2fcc4ef-9ec2-4bb8-86ae-6c6acc02e97e,Do you offer online courses or programs?,"Yes, we offer a variety of online courses and programs. You can find more information about our online offerings on our website or by speaking with an admissions counselor."
59c4752a-a6b3-465b-b47f-a7b167455e00,What is the student-to-faculty ratio at your university?,"Our student-to-faculty ratio varies by program, but we strive to maintain small class sizes and a low student-to-faculty ratio in order to provide our students with personalized attention and support."
d5861cc6-0459-48ae-bb08-303a57ec6bae,Can I transfer credits from another institution?,"Yes, we accept transfer credits from other accredited institutions. However, the amount of transfer credits that can be applied towards your degree may vary depending on the program and the specific courses you have taken."
cb5ceae7-c335-40f7-8f78-d93d4cbd7c46,What types of extracurricular activities are available for students?,"We offer a wide range of extracurricular activities, including sports teams, clubs, and organizations. You can find more information about our extracurricular offerings on our website or by speaking with a student life advisor."
e15ed1e3-9051-4e35-910c-885dfe5f0c79,What is the graduation rate for your university?,"Our graduation rates vary by program, but we are proud to have a high overall graduation rate. You can find more information about our graduation rates on our website or by speaking with an admissions counselor."
532f8626-7bbf-4f07-a379-adee4997e3ef,What are the admission requirements for your institution?,"Thank you for your interest in our institution! To be admitted, you will need to meet our minimum GPA requirement, submit transcripts from your previous institution(s), and complete our application process."
2a014b1e-c46b-4eac-b7c2-1cee52abebbf,How much does tuition cost per semester?,Our tuition rates vary based on the program of study and whether you are an in-state or out-of-state student. Please visit our website or contact our financial aid office for more information.
55d59e3e-c401-42a8-9a2c-318d12951602,Can you tell me about the academic programs offered at your institution?,"We offer a wide range of academic programs, including undergraduate and graduate degrees in fields such as business, education, healthcare, and more. Please visit our website or contact our admissions office for more information."
68600f8f-1a71-4244-b360-082d5bf872ef,Do you offer any scholarships or financial aid?,"Yes, we offer a variety of scholarships and financial aid options for eligible students. Please visit our website or contact our financial aid office for more information."
05184051-3a9c-4fda-aba6-7a0ef7ca0bc0,What is the student-to-faculty ratio at your institution?,"Our student-to-faculty ratio varies by program, but we strive to maintain a low ratio to ensure that our students receive personalized attention from their professors."
de4b2d87-6063-46ee-b99f-14b1d67da5f4,Can you tell me about the campus housing options available?,"We offer a variety of on-campus housing options, including traditional dormitories and apartment-style living. Please visit our website or contact our housing office for more information."
d8d6fcad-6d3f-43c1-b240-eefe2f39bcc2,What is the graduation rate at your institution?,"Our graduation rate varies by program, but we are proud to have a high percentage of students who successfully complete their degree requirements."
886c189a-01c8-4b56-b8af-c02755414851,Do you offer any study abroad programs?,"Yes, we offer a variety of study abroad programs for students who are interested in gaining international experience. Please visit our website or contact our study abroad office for more information."
288de733-9eda-400b-8251-316dc3837c14,Can you tell me about the extracurricular activities available for students?,"We offer a wide range of extracurricular activities, including sports teams, clubs and organizations, and community service opportunities. Please visit our website or contact our student activities office for more information."
8f8fd8c7-2ca2-4945-bbf1-82cd284b71ae,How do I apply for financial aid?,You can apply for financial aid by completing the Free Application for Federal Student Aid (FAFSA) online. Make sure to have your tax information and other financial documents ready.
6583e283-9f8a-4e49-bd16-0ba9103c3688,How do I know if I am eligible for a scholarship?,Scholarship eligibility varies depending on the organization offering the scholarship. Check the scholarship requirements to see if you meet the criteria.
f4abd5cb-c039-4b67-a96c-90a4d76cc97e,Can I transfer credits from another school?,"Yes, you may be able to transfer credits from another school. Check with your new school's admissions office for their specific transfer credit policies."
9f0d5817-95d9-4f74-a329-0799a695d18d,How do I know if a school is accredited?,Accreditation information can usually be found on a school's website or by contacting the school's admissions office. You can also check the U.S. Department of Education's database of accredited postsecondary institutions and programs.
