q_id,question,context
938da293-2b8a-4ce5-92d8-a92a7f71ea4b,What is the difference between a college and a university?,"A college is typically a smaller institution that offers undergraduate degrees, while a university is a larger institution that offers both undergraduate and graduate degrees."
ec02c648-9e7e-4f6f-8e11-ae4defbbb2ef,How do I apply for financial aid?,You can apply for financial aid by filling out the Free Application for Federal Student Aid (FAFSA) online. Be sure to check with your school's financial aid office for any additional requirements or deadlines.
3331a1f4-a073-49a0-b194-103cde66a1f4,What is the average cost of tuition at a four-year college?,"The average cost of tuition at a four-year college varies greatly depending on the institution and whether you are an in-state or out-of-state student. According to the College Board, the average cost of tuition and fees for the 2020-2021 academic year was $10,560 for in-state students at public four-year institutions and $27,020 for out-of-state students."
35bd8b32-489c-4c50-9b1b-fa72e2ae32a5,What is the difference between a grant and a scholarship?,"A grant is typically need-based and awarded by the government or other organizations to help cover the cost of education. A scholarship, on the other hand, is typically merit-based and awarded to students who demonstrate academic or other achievements."
9f548c23-c4e2-4163-8fd4-16a672443702,How do I transfer credits from one school to another?,You can transfer credits from one school to another by contacting the registrar's office at both institutions and following their specific transfer credit policies and procedures.
396608f5-4bce-4aa7-9b00-9c6e65be6bd2,What is the difference between a bachelor's and a master's degree?,"A bachelor's degree is an undergraduate degree that typically takes four years to complete, while a master's degree is a graduate degree that typically takes two years to complete after earning a bachelor's degree."
70dd72fb-4dd2-4125-afed-772dc348a970,How do I know if a school is accredited?,You can check if a school is accredited by searching for it on the U.S. Department of Education's Database of Accredited Postsecondary Institutions and Programs.
8bdd6042-071e-4b28-b1d2-c728cd26fbe6,What is the difference between a public and a private college?,"A public college is funded by the state or federal government and typically offers lower tuition rates for in-state students, while a private college is funded by private donations and typically has higher tuition rates."
6bb8ba35-a89a-4526-a4aa-933a87d276cf,What is the difference between a community college and a four-year college?,"A community college is a two-year institution that offers associate degrees and vocational training, while a four-year college is an institution that offers bachelor's degrees and higher."
e8f0b311-a741-4d1a-bc89-c6c2feba5829,What is the average class size at a college?,"The average class size at a college varies greatly depending on the institution and the course. However, according to the National Center for Education Statistics, the average undergraduate class size at public institutions was 27 students and 17 students at private institutions in the fall of 2019."
1ad11dca-2c9a-4b58-ad83-4b80f0f37c75,What are the requirements for admission to your university?,"Our university requires a completed application form, official transcripts, test scores, and any additional documents specific to your program of interest. You can find more information on our website or by contacting our admissions office."
ae37d34f-ed5c-4308-9949-9099f248cd79,Can you tell me more about the scholarships available for students?,"We offer a variety of scholarships for students, including academic, athletic, and need-based scholarships. You can find more information on our website or by contacting our financial aid office."
6a5c7ef4-e2f1-4813-8a26-0d68b8fdcf26,What is the student-to-faculty ratio at your school?,"Our student-to-faculty ratio is 15:1, which allows for personalized attention and a strong sense of community among students and faculty."
1b655a23-4559-44cf-a433-a646b5c52378,How do I apply for financial aid?,"To apply for financial aid, you must complete the Free Application for Federal Student Aid (FAFSA) and any additional forms required by our institution. You can find more information on our website or by contacting our financial aid office."
baab104b-11e0-422a-ac8f-330da5c7b356,What is the average class size at your school?,"Our average class size is 20 students, which allows for interactive and engaging classroom discussions and personalized attention from faculty."
883a1d56-f844-49a6-a21c-448ae0e8e46b,Can you tell me more about the internship opportunities available for students?,"We offer a variety of internship opportunities for students, including partnerships with local businesses and organizations. You can find more information on our website or by contacting our career services office."
4b8d469d-2e77-417c-a269-57b238e4b21f,What is the graduation rate for your school?,"Our graduation rate is 80%, which is above the national average and reflects our commitment to student success and support."
79f10ad9-65e9-4e79-9070-089b88852c68,How do I schedule a campus tour?,You can schedule a campus tour by visiting our website or by contacting our admissions office. We offer both in-person and virtual tour options for your convenience.
063c249b-f3ba-4356-a6f9-b1e7a1dcf7a1,What are the admission requirements for your university?,"The admission requirements vary depending on the program and level of study. Generally, we require a high school diploma or equivalent, transcripts, and standardized test scores. Some programs may also require additional materials such as essays, letters of recommendation, or portfolios."
b10e5c51-29b1-4d5d-be60-629f44b5a1e9,How can I apply for financial aid?,"You can apply for financial aid by completing the Free Application for Federal Student Aid (FAFSA) online. This will determine your eligibility for federal grants, loans, and work-study programs. Additionally, you may be eligible for scholarships or grants from the institution or private organizations."
f05163d0-7364-404a-8e44-fa37dc37d1c8,What are the tuition and fees for your institution?,The tuition and fees vary depending on the program and level of study. You can find detailed information on our website or by contacting our financial aid office.
54c6e1cd-e4e8-40b2-ada9-bf225d6b5082,What is the student-to-faculty ratio at your institution?,"Our student-to-faculty ratio varies depending on the program and level of study. Generally, we strive to maintain a low ratio to ensure that students receive personalized attention and support from their professors."
d4350878-2d65-44b6-9949-2fbb516773f9,What academic programs do you offer?,"We offer a wide range of academic programs at the undergraduate and graduate levels, including majors, minors, and certificates. You can find detailed information on our website or by contacting our admissions office."
089da8ae-1a8c-44f9-8be1-7265ef30ddf0,What is the average class size at your institution?,"The average class size varies depending on the program and level of study. Generally, we strive to maintain small class sizes to ensure that students receive personalized attention and support from their professors."
9fd1e8c8-aee6-458d-8645-acd194208dd3,What resources are available for students with disabilities?,"We offer a range of resources and accommodations for students with disabilities, including accessible facilities, assistive technology, and disability services staff. You can find detailed information on our website or by contacting our disability services office."
ff4ce801-2967-403d-bd9e-1c20b6a2734b,What is the graduation rate for your institution?,"Our graduation rate varies depending on the program and level of study. Generally, we strive to provide students with the resources and support they need to succeed academically and graduate on time. You can find detailed information on our website or by contacting our institutional research office."
fab9819e-e1d6-4909-b4fc-72a18b0b61cc,What is the difference between a college and a university?,A college typically offers undergraduate programs while a university offers both undergraduate and graduate programs.
b875f570-811a-46e1-8770-8ef0d438b2a2,How do I apply for financial aid?,You can apply for financial aid by completing the Free Application for Federal Student Aid (FAFSA) online.
8eaed90a-bb8b-4e2a-b41c-45703572074a,What is the maximum amount of federal student loans I can borrow?,"The maximum amount of federal student loans you can borrow depends on your year in school and your dependency status. For example, a dependent undergraduate student can borrow up to $31,000 in federal loans over four years."
1a00e5d5-53cd-432f-a4e6-d929db3ac144,How do I apply for scholarships?,You can apply for scholarships by researching and applying to individual scholarship programs. Your school's financial aid office may also have information on available scholarships.
73009be9-d1cd-49df-b236-40b4774a45e2,What is the difference between a grant and a scholarship?,"A grant is typically need-based financial aid that does not need to be repaid, while a scholarship is typically merit-based financial aid that also does not need to be repaid."
da5fb9b0-23bb-46c6-9f58-d7f93e5f9d1e,What is the difference between a private and public university?,"A private university is typically funded by tuition and private donations, while a public university is funded by state or federal government."
df1819c0-d69f-4461-a965-b8243a42f66b,How do I transfer credits from one school to another?,You can transfer credits by contacting the registrar's office at both schools and completing the necessary paperwork.
2b3f7118-c86a-40bd-9a23-90989e824430,What is the difference between an associate's degree and a bachelor's degree?,"An associate's degree is typically a two-year degree, while a bachelor's degree is typically a four-year degree."
afbfca08-27ae-424f-aac7-b3301eae36c4,What is the average cost of tuition at a four-year university?,"The average cost of tuition at a four-year university varies greatly depending on the school and location. However, the College Board reports that the average cost of tuition and fees for the 2020-2021 academic year was $10,560 at public four-year in-state schools and $37,650 at private non-profit four-year schools."
18f5ab4e-a5ca-40a8-ac6c-ffef7119f498,What is the difference between a major and a minor?,"A major is the primary area of study for a student, while a minor is a secondary area of study."
840a2e0f-6a80-4e50-ad17-8759d620febe,What are the requirements for admission to your university?,"To be admitted to our university, you must have a high school diploma or equivalent, meet our minimum GPA requirements, and provide transcripts and test scores."
33c89c6b-d15b-4020-9699-dcc235e8fc27,Can you tell me about the scholarship opportunities available at your school?,"We offer a variety of scholarships for academic achievement, athletic excellence, and other areas of interest. You can find more information on our website or by speaking with a financial aid advisor."
e4bbe268-0bfc-4ede-a1d8-11b0a37ae357,How can I apply for financial aid?,"To apply for financial aid, you must complete the Free Application for Federal Student Aid (FAFSA) and submit it to our school. You can also speak with a financial aid advisor for more information."
2576fadd-f3bb-4780-9cc4-307d79feb683,Do you offer online courses or distance learning programs?,"Yes, we offer a variety of online courses and degree programs for students who prefer to learn remotely. You can find more information on our website or by speaking with an admissions counselor."
5d8a25b3-0745-4feb-99e8-1d3c4a42df86,What is the student-to-faculty ratio at your school?,"Our student-to-faculty ratio is 15:1, which ensures that our students receive individualized attention and support from our faculty members."
4e632f9d-fd34-443f-9616-a64abdbe9797,Can you tell me about the extracurricular activities available at your school?,"We offer a wide range of extracurricular activities, including sports teams, clubs, and organizations. You can find more information on our website or by speaking with a student life advisor."
eb6c9e1e-7b1b-409f-80de-11bb6959931d,What is the graduation rate at your school?,"Our graduation rate is 80%, which is higher than the national average. We are proud of our students' success and work hard to support them throughout their academic journey."
b0cc6ad4-95af-4047-bfc3-621250d8780f,Can you tell me about the research opportunities available at your school?,"We offer a variety of research opportunities for students, including undergraduate research programs, independent study projects, and collaborations with faculty members. You can find more information on our website or by speaking with a research advisor."
a878700d-f7f6-4572-84f0-d18d76567417,What are the requirements for admission into your institution?,The requirements for admission vary depending on the program and level of study. Please visit our website or contact our admissions office for specific details.
76f0b156-7696-4356-ba89-27377efe9b7c,How much does tuition cost for your institution?,Tuition costs vary depending on the program and level of study. Please visit our website or contact our financial aid office for specific details.
33ba5077-c012-4483-a6ab-6c0212cd1d3e,What types of financial aid are available to students?,"We offer a variety of financial aid options including scholarships, grants, loans, and work-study programs. Please visit our website or contact our financial aid office for specific details."
70321ce0-5be1-4bc3-9595-3781c6211802,Can you provide information on the academic programs offered at your institution?,"We offer a wide range of academic programs including undergraduate and graduate degrees, as well as certificate and diploma programs. Please visit our website or contact our academic advising office for specific details."
6b7f28fe-8adb-4a96-9682-25d8bfd67dfa,What is the student-to-faculty ratio at your institution?,Our student-to-faculty ratio varies depending on the program and level of study. Please visit our website or contact our academic advising office for specific details.
f16df9a8-aaa2-477e-874c-319119750afc,What is the average class size at your institution?,The average class size varies depending on the program and level of study. Please visit our website or contact our academic advising office for specific details.
bb755573-c959-49e3-946d-5cdd45e12a60,What types of extracurricular activities are available to students?,"We offer a variety of extracurricular activities including clubs, sports teams, and volunteer opportunities. Please visit our website or contact our student affairs office for specific details."
8cf5bce8-0953-4a07-ba44-ba3149695672,What are the requirements for international students to attend your institution?,The requirements for international students vary depending on the program and level of study. Please visit our website or contact our international student services office for specific details.
6b676f42-3a09-41af-99d0-91fcf46cd417,What is the graduation rate for students at your institution?,Our graduation rate varies depending on the program and level of study. Please visit our website or contact our institutional research office for specific details.
c5bab7e1-d3c1-4424-9487-75aecfc4baae,What are the admission requirements for your school?,"Our school requires a completed application form, transcripts from previous schools attended, letters of recommendation, and a personal statement."
b40892a2-a68e-4c8c-aab8-2298d6b3dd9f,What is the student-to-faculty ratio at your university?,"Our university has a student-to-faculty ratio of 15:1, which allows for personalized attention and support for our students."
11aecf54-5006-4268-91aa-1d0f073f1e51,Are there any scholarships available for incoming students?,"Yes, we offer a variety of scholarships for incoming students based on academic merit, financial need, and other criteria. Please visit our website for more information."
93406189-04dc-4dfe-bdf6-cb44f7c0bfa2,What is the average class size at your college?,"Our college has an average class size of 20 students, which fosters a collaborative and engaging learning environment."
3533b989-88bf-4b5b-90af-c94339092a37,Can you tell me more about the study abroad programs offered at your university?,"Yes, we offer a variety of study abroad programs in partnership with universities around the world. These programs provide students with the opportunity to immerse themselves in different cultures and gain valuable international experience."
40b0df0b-2acb-4ec9-b5b9-1cb17f023d3b,How do I apply for financial aid?,"To apply for financial aid, you will need to complete the Free Application for Federal Student Aid (FAFSA) and any additional forms required by our institution. Our financial aid office can provide more information and guidance on the application process."
acb3ba65-231a-45b2-aaf3-677e82eb0646,What majors are offered at your college?,"We offer a wide range of majors across various disciplines, including business, engineering, humanities, social sciences, and more. Please visit our website for a full list of majors."
05472f01-1662-4f35-9c52-3b32eddef973,How does your university support student success?,"Our university provides a range of resources and support services to help students thrive academically and personally. These include academic advising, tutoring, career services, counseling, and more."
f2b94dfc-c056-4484-af67-71828ba813d5,What is the difference between a college and a university?,"A college typically offers undergraduate programs and awards associate's or bachelor's degrees, while a university offers both undergraduate and graduate programs and awards bachelor's, master's, and doctoral degrees."
393e7681-1bc4-4fb7-86ee-99eb5a874d6c,How do I apply for financial aid?,"To apply for financial aid, you need to complete the Free Application for Federal Student Aid (FAFSA) online. This application determines your eligibility for federal grants, loans, and work-study programs."
a5ae417d-c0c7-4f01-b0ff-cae2858f06c7,What is the average cost of tuition for a four-year college?,"According to the College Board, the average cost of tuition and fees for the 2020-21 school year was $10,560 for in-state students at public four-year colleges and $37,650 for private four-year colleges."
9f1de52e-6214-40d4-a447-9c4ecdfc5f95,What is the difference between a grant and a scholarship?,"A grant is a type of financial aid that does not need to be repaid, while a scholarship is a type of financial aid that is typically awarded based on merit or need and does not need to be repaid."
ad469eba-5c04-4a6c-9b4a-85d00ca879c4,What is the difference between a major and a minor?,"A major is the primary field of study that a student chooses to focus on and complete the majority of their coursework in, while a minor is a secondary field of study that a student can choose to complement their major."
2e736115-dcb0-4157-9426-d3bcedffa078,How do I transfer credits from one college to another?,"To transfer credits from one college to another, you need to contact the registrar's office at both schools and follow their specific transfer credit policies and procedures."
2e6e22f1-6a3c-469a-ba27-1365650ca05a,What is the difference between a traditional classroom setting and an online classroom setting?,"In a traditional classroom setting, students attend classes in person and interact with their professors and peers face-to-face, while in an online classroom setting, students attend classes remotely and interact with their professors and peers through online platforms such as video conferencing and discussion forums."
41e0d2b7-b5f9-48d7-aaf3-2151855d4f26,How do I choose a major?,"To choose a major, you should consider your interests, skills, and career goals, and research the different majors and programs offered by colleges and universities to find one that aligns with your aspirations."
793bd5a2-a296-43de-8fae-98d62f95b421,What is the difference between a public and private college?,"A public college is funded by the government and typically offers lower tuition rates for in-state students, while a private college is funded by private donations and tuition and typically offers smaller class sizes and more personalized attention."
915b192a-71e4-4b91-b5d7-db178aedf405,How can I apply for financial aid for college?,You can apply for financial aid by filling out the Free Application for Federal Student Aid (FAFSA) online. Be sure to submit it as soon as possible to maximize your chances of receiving aid.
05da020e-fe43-41a8-8377-f7bfdbff84f4,What is the difference between a grant and a scholarship?,"A grant is a form of financial aid that does not need to be repaid, while a scholarship is typically awarded based on merit or achievement and may or may not need to be repaid."
e45ae90d-6c8a-4cb2-b514-889f61bd5209,Can you tell me more about online learning options?,"Online learning options can vary depending on the institution, but generally they allow students to complete coursework and interact with instructors and classmates remotely. Some online programs may also offer live lectures or discussions."
b1e37eba-eb0e-47f8-8688-5c572971905a,How can I find out more about a specific college's admission requirements?,You can typically find information about a college's admission requirements on their website or by contacting their admissions office directly.
4fcd4535-bae9-4a68-ab9e-5d6f59427846,What is the average cost of tuition at a four-year college?,"The average cost of tuition at a four-year college varies depending on the institution and whether you are an in-state or out-of-state student. According to the College Board, the average cost of tuition and fees for the 2020-2021 school year was $10,560 for in-state students at public four-year institutions and $27,020 for out-of-state students at public four-year institutions."
cdeeb95d-f6d3-4fa5-ab19-e8322f8c277c,Are there any scholarships available specifically for students pursuing a degree in a certain field?,"Yes, there are many scholarships available for students pursuing degrees in specific fields, such as STEM, business, or the arts. You can search for these scholarships online or speak to your school's guidance counselor for more information."
14c6a8cb-73f8-4d17-bc29-bd8bf0fae4e0,Can you tell me more about student loan repayment options?,"There are several student loan repayment options available, including standard repayment, income-driven repayment, and extended repayment. You can learn more about these options by contacting your loan servicer or visiting the Federal Student Aid website."
057fbd90-5d67-40c8-beb0-4bfbb7f79f1f,How can I find out if a college is accredited?,You can typically find information about a college's accreditation status on their website or by contacting their admissions office. You can also search for accredited institutions on the website of the Council for Higher Education Accreditation.
b266e742-21ad-4aa3-a6dd-71305c86258f,How do I apply for financial aid?,You can apply for financial aid by completing the Free Application for Federal Student Aid (FAFSA) online at fafsa.ed.gov.
a7bf994e-1ade-4e98-9ad4-158b8cb2b8a1,What is the difference between a grant and a loan?,"A grant is a form of financial aid that does not have to be repaid, while a loan is a form of financial aid that must be repaid with interest."
3edd44a1-648e-410a-92c7-80227c85f7a0,How do I know if I am eligible for a scholarship?,Eligibility for scholarships varies depending on the scholarship. You can find out more information about specific scholarship requirements by contacting the scholarship provider or searching online.
de15e06f-f905-4c39-a527-0c57f46e4371,Can I transfer credits from another college to this one?,"Yes, you may be able to transfer credits from another college to this one. However, the transferability of credits depends on the policies of both schools and the specific courses you have taken."
4b908756-7cd9-4255-8110-7a691b60e3a3,How do I know if I am eligible for in-state tuition?,"Eligibility for in-state tuition varies depending on the state and the specific college or university. Generally, you must meet certain residency requirements to be eligible for in-state tuition."
5d8e8d8a-e289-40b7-bb8a-caca80393bac,How do I apply for admission to this college?,You can apply for admission to this college by submitting an application online or by mail. Be sure to check the college's admission requirements and deadlines before applying.
daa5d6b3-525f-48af-8a2c-2e39049f5f3e,What is the student-to-faculty ratio at this college?,The student-to-faculty ratio at this college varies depending on the specific program and department. You can find out more information about the student-to-faculty ratio by contacting the college or searching online.
3aad9a65-147f-481e-84b7-a64dbd36fd7a,How do I know if this college is accredited?,You can find out if this college is accredited by checking with the accrediting agency or by searching online. Accreditation is important because it ensures that the college meets certain academic standards.
27059c96-c636-42bf-bdd8-726ef426109b,What are the admission requirements for this program?,The admission requirements vary depending on the program. Please visit our website or contact the admissions office for more information.
2dc432ae-3173-4b97-9730-31f6a8cbebc2,How do I apply for financial aid?,You can apply for financial aid by completing the Free Application for Federal Student Aid (FAFSA) online. Our financial aid office can also assist you with any questions or concerns.
