q_id,question,context
06817c72-1643-4ea9-9cbe-1dc7aae24885,Do you offer online courses or programs?,"Yes, we offer a variety of online courses and programs to provide flexibility for our students."
aba75d77-a4df-45f4-836d-ba7c6cb5dc0f,What kind of support services are available for students?,"We offer a range of support services for our students, including academic advising, tutoring, career services, and counseling services."
b7bda2f3-0022-40d3-a942-ccad371a56c9,Can you tell me more about the research opportunities available for students?,"Our institution offers a variety of research opportunities for students, including undergraduate research programs, research assistant positions, and opportunities to work with faculty on research projects."
63dda541-9a70-4933-8fb6-7bb30754b6ce,What kind of extracurricular activities are available for students?,"We offer a wide range of extracurricular activities for our students, including clubs and organizations, intramural sports, community service programs, and cultural events."
01e516f4-e3d4-4c03-afe6-b1e93caa8a70,How does your institution support diversity and inclusion?,"We are committed to creating a welcoming and inclusive environment for all students, and we offer a range of programs and initiatives to support diversity and inclusion on campus, including multicultural student organizations, diversity training for faculty and staff, and cultural events and celebrations."
a9b32290-1130-4b35-8039-0abee039897d,What are the requirements to become a teacher?,"To become a teacher, you typically need to have a bachelor's degree in education or a related field, complete a teacher preparation program, and pass state certification exams."
82955144-9cb8-41a1-a2a2-915937b074a2,How can I apply for financial aid for college?,"To apply for financial aid for college, you will need to complete the Free Application for Federal Student Aid (FAFSA) online. This application will determine your eligibility for federal grants, loans, and work-study programs."
f9872ac5-8826-447e-a4a7-2c5f29376ca9,How can I transfer credits from one college to another?,"To transfer credits from one college to another, you will need to contact the registrar's office at both institutions to determine which credits are transferable. You may also need to provide transcripts and other documentation."
012b7a24-0620-4989-b069-995da8749ba9,What is the average cost of tuition for a four-year college?,"The average cost of tuition for a four-year college varies widely depending on the institution and location. However, according to the College Board, the average cost of tuition and fees for the 2020-2021 academic year was $10,560 for in-state students at public four-year colleges and $37,650 for private non-profit four-year colleges."
d69af641-8d56-404b-969b-ce4e3a96ed7c,What is the difference between a grant and a loan?,"A grant is a form of financial aid that does not need to be repaid, while a loan is a form of financial aid that must be repaid with interest. Grants are typically awarded based on financial need or academic merit, while loans are available to most students regardless of financial need."
39ab4b2a-efaf-4113-aa76-5fff9cbcaab8,What is the average salary for a teacher?,"The average salary for a teacher varies widely depending on the location, level of education, and years of experience. However, according to the Bureau of Labor Statistics, the median annual wage for elementary, middle, and high school teachers was $60,660 in May 2020."
97794ffd-9725-404f-96bc-89181ec1376a,How can I find scholarships for college?,"You can find scholarships for college by searching online databases, checking with your school's financial aid office, and contacting local organizations and businesses. You may also be eligible for scholarships based on your academic or extracurricular achievements."
415896de-458e-4d70-9eb2-85b0356053fc,What are the admission requirements for the undergraduate program?,"To be considered for admission to our undergraduate program, applicants must have a high school diploma or equivalent, meet minimum GPA requirements, and submit standardized test scores."
97f115dc-a38e-4266-9d80-1a8ea5db5292,What is the tuition cost for the graduate program?,The tuition cost for our graduate program varies depending on the program and the number of credit hours taken. Please visit our website or contact the admissions office for specific information.
8bc71a91-8681-4932-a9e1-de77c83c246a,Can you provide information on financial aid and scholarships?,"Yes, we offer a variety of financial aid options, including scholarships, grants, loans, and work-study programs. Please visit our website or contact the financial aid office for more information."
76c6ff94-5472-487b-8c1c-32260d508084,What is the student-to-faculty ratio?,"Our student-to-faculty ratio varies depending on the program and the size of the class. However, we are committed to providing small class sizes and personalized attention to our students."
80dfc10d-36be-4f83-a36e-40375cff4c76,What is the graduation rate for your institution?,"Our graduation rate varies depending on the program and the cohort. However, we are proud to have a high graduation rate and a strong track record of helping our students achieve their academic goals."
2c61c8b7-f5a9-474a-bc04-e4efe415093e,Can you provide information on study abroad programs?,"Yes, we offer a variety of study abroad programs that allow students to gain international experience and broaden their cultural horizons. Please visit our website or contact the study abroad office for more information."
5d29038f-2891-49a8-8bb0-82642d96ff18,What is the job placement rate for graduates?,"Our job placement rate varies depending on the program and the industry. However, we are proud to have a strong network of alumni and employer partners who actively recruit our graduates."
b915f07d-1527-411b-90d9-2d37b4fdf54c,What are the requirements for admission to your college?,Our college has specific admission requirements that vary depending on the program. You can find detailed information on our website or by contacting our admissions office.
884738d7-c912-4be6-8b9b-063aa7af523b,Can you tell me more about the financial aid options available?,"We offer a variety of financial aid options, such as scholarships, grants, and loans. Our financial aid office can provide you with more information on eligibility and the application process."
8f7e42c7-d015-4aa4-8b19-0de59e379182,What programs do you offer for students interested in studying abroad?,We offer a range of study abroad programs in partnership with universities around the world. Our study abroad office can provide you with more information on program options and the application process.
f75e471e-1187-49cc-8084-81a6040d5001,How can I get involved in extracurricular activities on campus?,We have a variety of clubs and organizations on campus that cater to a range of interests. You can find more information on our website or by contacting our student activities office.
675870f3-5a88-4888-97d3-c70dbe0da52f,What support services do you offer for students with disabilities?,We have a dedicated office for disability services that provides accommodations and support for students with disabilities. You can find more information on our website or by contacting the office directly.
16a82b9d-5b20-4f6c-97a7-a0f856a596e2,Can you tell me more about the faculty in the program I'm interested in?,Our faculty members are experts in their respective fields and are dedicated to providing high-quality education to our students. You can find more information on our website or by contacting the department directly.
fa8cba23-e69c-4c7e-84ba-47dfbe0f15fd,What is the student-to-faculty ratio at your school?,"Our student-to-faculty ratio varies depending on the program, but we strive to maintain small class sizes to ensure personalized attention and a high-quality learning experience."
1d76c032-65b1-4f1d-86fd-5322116ca473,What is the graduation rate at your school?,"Our graduation rate varies depending on the program, but we are proud to have a high percentage of students who successfully complete their degrees. You can find more information on our website or by contacting our office of institutional research."
6e232088-1e99-4641-aa93-7457d65cdba9,Can you tell me more about the financial aid options available for students?,"We offer a variety of financial aid options, including scholarships, grants, and loans. Please visit our website or contact our financial aid office for more information."
e4622aef-4e05-4cdb-bae4-cec25a97c004,How do I apply for a scholarship?,The scholarship application process varies depending on the scholarship. Please visit our website or contact our scholarship office for more information.
87d00251-2fb1-4999-bf0a-e162e7ddde53,What are the tuition fees for your institution?,The tuition fees vary depending on the program and level of study. Please visit our website or contact our admissions office for more information.
a8e05ef5-6b35-4a3f-9714-717fee59e62f,Can you tell me more about the academic programs offered at your institution?,"We offer a wide range of academic programs, including undergraduate and graduate degrees, as well as certificate and diploma programs. Please visit our website or contact our academic advising office for more information."
ea30d0f7-6f7c-4abd-80b8-49d70cfe706e,How do I transfer credits from another institution?,The process for transferring credits varies depending on the institution and program. Please visit our website or contact our admissions office for more information.
a8827c20-0dfd-4d2a-ba11-f4bbb5b0ba35,What is the student-to-faculty ratio at your institution?,Our student-to-faculty ratio varies depending on the program and level of study. Please visit our website or contact our academic advising office for more information.
6d385924-db80-457c-afa8-d90289b61c48,Can you tell me more about the campus facilities and resources available to students?,"We offer a wide range of campus facilities and resources, including libraries, computer labs, student centers, and more. Please visit our website or contact our student services office for more information."
a5bc7f1e-a8a0-46ee-948e-c7efd0e28aeb,What is the difference between a grant and a loan?,"A grant is a form of financial aid that does not need to be repaid, while a loan is borrowed money that must be paid back with interest."
56de86e0-7deb-4585-9e85-5ecc269563b9,How do I transfer credits from one institution to another?,"To transfer credits, you will need to contact the registrar's office at both institutions and provide them with the necessary documentation, such as transcripts and course descriptions."
737bdd72-1800-4599-a89f-33acbaa47bca,What is the difference between a bachelor's degree and an associate's degree?,"A bachelor's degree typically takes four years to complete and provides a more in-depth education in a specific field, while an associate's degree usually takes two years and provides a more general education."
055a1bd1-2bc8-4f5a-b5ab-ed35b7e6f3c0,How do I know if a college is accredited?,You can check if a college is accredited by searching the database of accredited institutions on the website of the U.S. Department of Education.
d1c89c11-b2be-4c77-a915-7bbe5c3b5179,What is the average cost of tuition at a four-year college?,"The average cost of tuition at a four-year college varies depending on the institution and location, but it is typically around $10,000 to $35,000 per year."
8152ea11-d7c6-40fc-9b79-4a2718715047,What is the difference between a public and private college?,"A public college is funded by the government and usually has lower tuition costs, while a private college is funded by private donations and usually has higher tuition costs."
134c9e41-bb79-4230-8dee-aeb0fee673f6,How do I apply for scholarships?,You can apply for scholarships by researching available scholarships online and submitting an application that typically includes an essay and letters of recommendation.
6a467f98-e416-4d82-9c14-9b72a2675c03,What is the difference between an online degree and a traditional degree?,"An online degree is earned through online courses and can be completed from anywhere, while a traditional degree is earned through in-person courses on a college campus."
00d99b37-8fa4-4384-976e-a5e2021b5eee,How do I apply for financial aid?,You can apply for financial aid by filling out the Free Application for Federal Student Aid (FAFSA) online. Be sure to have your tax information and other financial documents on hand when completing the application.
2f6947cd-0250-499f-b658-080b585ffc99,How do I know if I am eligible for scholarships?,"Eligibility for scholarships varies depending on the specific scholarship. Some scholarships may be based on academic merit, while others may be based on financial need or other criteria. Check with your school's financial aid office or search online for scholarship opportunities."
36b98cf9-54e0-4a6c-9cdd-a3308edfe7d7,How do I transfer my credits to another school?,"To transfer your credits to another school, you will need to request an official transcript from your current school. Contact the registrar's office at your current school to find out how to request a transcript."
5a716c5c-a9e7-480f-b258-1dd2abc57d36,How do I choose a major?,"Choosing a major can be a difficult decision. Consider your interests, skills, and career goals when choosing a major. It is also a good idea to talk to academic advisors and career counselors for guidance."
397613f0-fc76-4840-b517-2d66923fabca,How do I get involved in extracurricular activities?,"There are many ways to get involved in extracurricular activities, such as joining clubs or organizations, participating in sports or intramural activities, or volunteering in the community. Check with your school's student activities office for more information."
db47bf7d-2a57-4a5b-b344-45ceec58cee7,How do I apply for a student visa?,"To apply for a student visa, you will need to complete the application process through the U.S. Department of State. Be sure to have all required documentation, including a valid passport and proof of acceptance to a U.S. school."
80f868f2-d1ac-4538-9520-dcf87eb0cb63,How do I find a job after graduation?,"Finding a job after graduation can be challenging. Start by networking with alumni and professionals in your field, and consider attending career fairs and job search workshops. You can also check online job boards and search for job openings on company websites."
86a450fb-7da2-45e2-bbda-720c5e0b61d5,How do I apply for financial aid?,"To apply for financial aid, you will need to complete the Free Application for Federal Student Aid (FAFSA). This can be done online at fafsa.ed.gov."
cddf9fb7-1c75-454c-8ecb-d1f22e6e97bd,What is the difference between a grant and a loan?,"A grant is money that is awarded to a student that does not need to be repaid. A loan, on the other hand, is money that is borrowed and must be repaid with interest."
6614db8a-fa41-4ed6-abdc-ce57d0cc9ec8,How do I know if I qualify for a scholarship?,Scholarship requirements vary depending on the scholarship. You can check with the scholarship provider or your school's financial aid office for information on eligibility.
de66b3cb-635f-4faa-9e2d-9ef905b82611,How do I transfer credits from another school?,"To transfer credits from another school, you will need to request an official transcript from the school you attended. Your new school will then evaluate your transcript to determine which credits can be transferred."
04089e32-1fcb-471b-bed2-0d3641f4b8df,How do I know if a school is accredited?,You can check if a school is accredited by visiting the website of the accrediting agency. You can also check with the school's admissions office or the Department of Education.
c17a635f-1fc0-413a-988c-aa76cc14338c,What is the difference between a bachelor's degree and an associate's degree?,A bachelor's degree typically takes four years to complete and provides a more comprehensive education in a specific field. An associate's degree takes two years to complete and provides a more general education.
143774f1-ea28-490c-8ca5-0b6768f2fe96,How do I apply for a student loan?,"To apply for a student loan, you will need to complete the Free Application for Federal Student Aid (FAFSA). You can also apply for private student loans through your bank or other financial institution."
ad9496a5-deac-43db-9b00-f58da831d921,How do I know if a school is a good fit for me?,"To determine if a school is a good fit for you, you should consider factors such as location, cost, size, programs offered, and campus culture. You can also visit the school's campus and talk to current students and faculty to get a better sense of the school."
5d312330-caa1-4959-bc6b-36e83d3d3c1f,What is the difference between a college and a university?,"A college typically offers undergraduate degrees in a specific field, while a university offers both undergraduate and graduate degrees in a variety of fields."
a3d3a7c6-cb4e-4f2d-a395-043eeb84b368,How do I apply for financial aid?,You can apply for financial aid by completing the Free Application for Federal Student Aid (FAFSA) online. Be sure to check with your school for any additional requirements or deadlines.
13c19ccd-af83-4d5c-9702-9a73e5559b73,How do I know if a school is accredited?,You can check a school's accreditation status by searching for it on the website of the U.S. Department of Education's Database of Accredited Postsecondary Institutions and Programs.
25ed32ee-122f-413c-b164-3e5a239bbabf,How do I transfer credits from one school to another?,You can transfer credits by requesting an official transcript from your previous school and submitting it to your new school. Be sure to check with your new school for any additional requirements or restrictions.
e25c1d6e-52a1-4b72-a2b8-44cdddb96b11,What is the difference between a bachelor's degree and an associate's degree?,"A bachelor's degree typically requires four years of study and offers a more comprehensive education in a specific field, while an associate's degree typically requires two years of study and offers a more general education."
17c121d8-3de3-4b51-835f-9c440e8f8ec3,How do I choose a major?,"You can choose a major by exploring your interests, skills, and career goals. It may also be helpful to speak with an academic advisor or career counselor."
1abbbf55-4696-4d14-a4de-f724a60af0c8,What is the difference between a for-profit and a non-profit college?,"A for-profit college is operated by a corporation and is focused on generating profit, while a non-profit college is operated by a board of trustees and is focused on providing education and services to students."
453746be-6f08-4ba8-9333-c81058906ec6,How do I apply for financial aid?,You can apply for financial aid by completing the Free Application for Federal Student Aid (FAFSA) online. Be sure to gather all necessary financial information before starting the application process.
69edca76-d149-484d-8bd5-6a6b81d423ed,How do I transfer credits from another institution?,"You can transfer credits from another institution by requesting official transcripts from your previous school and submitting them to your current school's registrar office. Each school has its own transfer credit policy, so be sure to check with your current school to see which credits will transfer."
8f81d370-70ca-43e0-85fa-e111601d4f35,Can I take online courses?,Yes! Many schools offer online courses and degree programs. Check with your school's registrar office or website to see what online options are available.
aa48080f-2c6a-4aae-8bc5-0b56c00bd00d,How do I declare a major?,You can declare a major by meeting with an academic advisor or visiting your school's registrar office. They will guide you through the process and help you choose the right major for your career goals.
2867ccd1-12c9-4fed-986d-e71b429d9e73,What is the difference between a bachelor's and an associate's degree?,A bachelor's degree typically takes four years to complete and provides a more in-depth education in a specific field. An associate's degree takes two years to complete and provides a more general education in a specific field.
b664aab0-f82b-4146-acb9-412dad499e2e,How do I apply for graduate school?,You can apply for graduate school by submitting an application to the school of your choice. Be sure to check the application requirements and deadlines for each school you are interested in.
a65aa218-1b09-4cb9-8ae2-898f771082e6,How do I find scholarships?,"You can find scholarships by searching online databases, checking with your school's financial aid office, and contacting local organizations and businesses. Be sure to read the eligibility requirements carefully before applying."
e1cb4f0c-78af-43e7-86fc-3c595ad0bdd4,How do I know if a school is accredited?,You can check if a school is accredited by visiting the U.S. Department of Education's website or the Council for Higher Education Accreditation's website. Accreditation ensures that a school meets certain academic standards and is recognized by other institutions and employers.
46cb9f4f-cb45-44c4-8adc-18a33eb692a9,What is the difference between a grant and a loan?,"A grant is a form of financial aid that does not need to be repaid, while a loan is a form of financial aid that must be repaid with interest. Be sure to read the terms and conditions of any financial aid offer carefully before accepting."
70d1086d-cab1-4785-84e8-201d13cbd748,What are the admission requirements for your institution?,Thank you for your interest in our institution! Our admission requirements vary depending on the program you are interested in. Please visit our website or contact our admissions office for specific details.
0ed2bbef-4ef2-4491-a817-5d83e8ec4955,Can you tell me more about the financial aid options available for students?,"Absolutely! We offer a variety of financial aid options for our students, including scholarships, grants, and loans. Please visit our website or contact our financial aid office for more information."
b36de02f-550e-4f95-a421-916fe9bacd1a,What is the student-to-faculty ratio at your institution?,"Our student-to-faculty ratio is X:1, which ensures that our students receive personalized attention and support from our faculty members."
724ce20d-947c-40b7-be5d-7638f33e5c96,What types of majors and programs do you offer?,"We offer a wide range of majors and programs, including business, engineering, education, healthcare, and more. Please visit our website or contact our academic advising office for more information."
a8705fc3-b3f0-44cd-8e89-5c228b48f37a,Can you tell me about the campus life and extracurricular activities available for students?,"Our campus is full of life and activity! We offer a variety of extracurricular activities, including clubs, sports teams, and student organizations. Please visit our website or contact our student life office for more information."
0dc589b1-8980-4623-8f0e-f0e258c3c496,What is the average class size at your institution?,"Our average class size is X students, which allows for a more personalized and interactive learning experience for our students."
27df3325-94d1-4b54-bc76-57ceafdc58b5,Can you tell me about the research opportunities available for students?,"We offer a variety of research opportunities for our students, including undergraduate research programs, research assistantships, and more. Please visit our website or contact our research office for more information."
5ae69f65-7a3d-4dc8-83b0-e6fa63429408,What is the graduation rate at your institution?,"Our graduation rate is X%, which is a testament to the quality of education and support our students receive throughout their time at our institution."
78daf3c9-e73d-4a95-ab2e-4f7bb28bd872,Can you tell me about the career services available for students?,"We offer a comprehensive career services program for our students, including resume building, job search assistance, and networking opportunities. Please visit our website or contact our career services office for more information."
96ba918e-52ab-4ad1-b85d-878a8f046fad,What is the student body diversity like at your institution?,"Our student body is diverse and inclusive, and we are proud to have students from a variety of backgrounds and cultures. Please visit our website or contact our diversity and inclusion office for more information."
f2fbd8a9-45f2-4e08-81cd-cb7c2f2d167a,What is the application deadline for your school?,The application deadline for our school varies depending on the program you are applying to. Please visit our website or contact our admissions office for more information.
fa254e56-5ef0-4e2d-aaf8-4daf064d180c,What majors do you offer?,"We offer a wide range of majors, including business, engineering, education, health sciences, and more. Please visit our website or contact our admissions office for a complete list of majors."
ce8421f2-c501-44ce-a1e8-e715d30bd455,How much does tuition cost?,Tuition costs vary depending on the program you are enrolled in and whether you are an in-state or out-of-state student. Please visit our website or contact our financial aid office for more information.
0c0f5e10-5f17-4b42-8028-b4c9fae17dfb,Can I transfer credits from another school?,"Yes, you may be able to transfer credits from another school. However, this will depend on the school you are transferring from and the program you are transferring into. Please contact our admissions office for more information."
26f0073b-2c17-4d99-8add-562ee5189f71,Do you offer online courses?,"Yes, we offer a variety of online courses and programs. Please visit our website or contact our online learning department for more information."
